{
  "schema_version": "openclaw.task-runner.exec-plan.v1alpha1",
  "plan_id": "tr-exec-plan-dev-20260323",
  "task_id": "task-runner-dev-20260323",
  "image": {
    "reference": "openclaw-task-claude:2026-03-v3",
    "pull_policy": "if_not_present",
    "run_as_user": "runner",
    "workdir": "/workspace/repo",
    "entrypoint": "/usr/local/bin/task-runner-entrypoint"
  },
  "workspace": {
    "layout_mode": "dev",
    "layout_artifact": "fixtures/task-runner-workspace-layout/valid-dev-workspace.json",
    "root_path": "/workspace",
    "repo_path": "/workspace/repo",
    "inputs_path": "/workspace/inputs",
    "outputs_path": "/workspace/outputs",
    "artifact_export_path": "/workspace/outputs/export"
  },
  "inputs": {
    "required_inputs": [
      "/workspace/inputs/request.md",
      "/workspace/inputs/tooling-lock.json"
    ]
  },
  "outputs": {
    "required_artifacts": [
      "/workspace/outputs/summary.md",
      "/workspace/outputs/summary.json",
      "/workspace/outputs/diff.patch",
      "/workspace/outputs/export"
    ],
    "artifact_export_path": "/workspace/outputs/export",
    "preserve_failed_run_logs": true
  },
  "environment": {
    "allowed": [
      "TASK_ID",
      "RUN_ID",
      "RUNNER_TOOL",
      "RUNNER_MODE",
      "WORKSPACE_MODE",
      "TASK_REPO_PATH",
      "TASK_INPUTS_PATH",
      "TASK_OUTPUTS_PATH",
      "ARTIFACT_EXPORT_PATH",
      "HTTP_PROXY",
      "HTTPS_PROXY",
      "NO_PROXY",
      "TASK_API_TOKEN_FILE",
      "TASK_LLM_BASE_URL"
    ],
    "required": [
      "TASK_ID",
      "RUN_ID",
      "RUNNER_TOOL",
      "RUNNER_MODE",
      "WORKSPACE_MODE",
      "TASK_REPO_PATH",
      "TASK_INPUTS_PATH",
      "TASK_OUTPUTS_PATH",
      "ARTIFACT_EXPORT_PATH"
    ],
    "forbidden": [
      "OPENCLAW_CONFIG_PATH",
      "OPENCLAW_STATE_DIR",
      "DOCKER_HOST",
      "OPENAI_API_KEY",
      "ANTHROPIC_AUTH_TOKEN",
      "OPENCLAW_BROKER_SOCKET",
      "SSH_AUTH_SOCK"
    ]
  },
  "tool_contract": {
    "agent_tools": {
      "allow": [
        "read",
        "write",
        "edit",
        "apply_patch",
        "exec",
        "process"
      ],
      "deny": [
        "sessions_spawn",
        "elevated"
      ]
    },
    "container_binaries": {
      "expected_available": [
        "bash",
        "git",
        "jq",
        "python3",
        "rg"
      ],
      "expected_unavailable": [
        "docker",
        "sudo",
        "systemctl",
        "mount",
        "umount"
      ]
    }
  },
  "invocation": {
    "runner": "claudecode",
    "mode": "non_interactive",
    "bootstrap_path": "/usr/local/bin/bootstrap-claudecode",
    "prompt_source": "stdin"
  },
  "network": {
    "mode": "restricted-egress",
    "allow_host_network": false,
    "allowed_endpoints": [
      "llm-gateway.internal:443",
      "packages.mirror.internal:443"
    ]
  },
  "privilege": {
    "run_as_non_root": true,
    "user": "runner",
    "allow_privilege_escalation": false,
    "read_only_rootfs": true,
    "no_new_privileges": true
  },
  "boundary_carry_forward": {
    "repo_side_only": true,
    "live_side_publish_performed": false,
    "broker_dispatch_performed": false,
    "real_docker_run_required": false,
    "openclaw_runtime_modified": false
  }
}
